### ISSUE TITLE
Populate errno=11 Resource temporarily unavailable                                  

### ISSUE THREAD

**Issue by kricha** [php-enqueue/enqueue-dev#907]
Hello,

when i'm trying to populate my index in es, i'm getting this error from populating command:
```bin/console fos:elastica:populate --pager-persister=queue --max-per-page=1000```
```
Resetting app

In AmqpProducer.php line 77:
                                                                               
  fwrite(): send of 287 bytes failed with errno=11 Resource temporarily unava  
  ilable                                                                       
                                                                               

In StreamIO.php line 301:
                                                                               
  fwrite(): send of 287 bytes failed with errno=11 Resource temporarily unava  
  ilable                                      
```                                 

Dependencies:
```
composer show enqueue*
enqueue/amqp-lib        0.9.10 Message Queue Amqp Transport
enqueue/amqp-tools      0.9.8  Message Queue Amqp Tools
enqueue/dsn             0.9.2  Parse DSN
enqueue/elastica-bundle 0.9.2  The bundle adds extra features to FOSElasticaBundle bundle
enqueue/enqueue         0.9.11 Message Queue Library
enqueue/enqueue-bundle  0.9.10 Message Queue Bundle
enqueue/null            0.9.2  Enqueue Null transport
```

Settings:
```
enqueue:
    default:
        transport:
            driver: "lib"
            dsn: "%env(ENQUEUE_DSN)%"
            connection_timeout: 60
            write_timeout: 60
            read_timeout: 60
#            channel_rpc_timeout: 0
            read_write_timeout: 60
            persisted: true
        client: ~
        extensions:
            doctrine_clear_identity_map_extension: true

enqueue_elastica:
    transport: default
    doctrine:
        queue_listeners: []
```

This error appears, when i'm trying to publish ~4k messages with payload like this:
```
{"options":{"max_per_page":"1000","delete":true,"reset":true,"ignore_errors":false,"sleep":0,"indexName":"app","typeName":"order","query_builder_method":"transformDataForGrid"},"page":816}
```

rabbitmq - 3.7.15

TCPDUMP from rabbitmq:
```
11:21:42.288587 IP (tos 0x0, ttl 64, id 26015, offset 0, flags [DF], proto TCP (6), length 338)
    populate.host.60532 > 953cadd34749.5672: Flags [P.], cksum 0x5970 (incorrect -> 0xf76a), seq 27571:27857, ack 615, win 237, options [nop,nop,TS val 3856144 ecr 3856144], length 286
E..Re.@.@.{..........t.(...}J[......Yp.....
.:...:..........<.(....fos_elastica_populate........-.<.............amq.gen-j3C2DcF1HNvErbC3NZxzOA........{"options":{"max_per_page":"1000","delete":true,"reset":true,"ignore_errors":false,"sleep":0,"indexName":"app","typeName":"order","query_builder_method":"transformDataForGrid"},"page":96}.
11:21:42.288711 IP (tos 0x0, ttl 64, id 26018, offset 0, flags [DF], proto TCP (6), length 338)
    populate.host.60532 > 953cadd34749.5672: Flags [P.], cksum 0x5970 (incorrect -> 0xf40d), seq 28429:28715, ack 615, win 237, options [nop,nop,TS val 3856144 ecr 3856144], length 286
E..Re.@.@.{..........t.(..".J[......Yp.....
.:...:..........<.(....fos_elastica_populate........-.<.............amq.gen-j3C2DcF1HNvErbC3NZxzOA........{"options":{"max_per_page":"1000","delete":true,"reset":true,"ignore_errors":false,"sleep":0,"indexName":"app","typeName":"order","query_builder_method":"transformDataForGrid"},"page":99}.
11:21:42.288820 IP (tos 0x0, ttl 64, id 26021, offset 0, flags [DF], proto TCP (6), length 339)
    populate.host.60532 > 953cadd34749.5672: Flags [P.], cksum 0x5971 (incorrect -> 0x7509), seq 29289:29576, ack 615, win 237, options [nop,nop,TS val 3856144 ecr 3856144], length 287
E..Se.@.@.{..........t.(..&3J[......Yq.....
.:...:..........<.(....fos_elastica_populate........-.<.............amq.gen-j3C2DcF1HNvErbC3NZxzOA........{"options":{"max_per_page":"1000","delete":true,"reset":true,"ignore_errors":false,"sleep":0,"indexName":"app","typeName":"order","query_builder_method":"transformDataForGrid"},"page":102}.
11:21:42.288950 IP (tos 0x0, ttl 64, id 26024, offset 0, flags [DF], proto TCP (6), length 339)
    populate.host.60532 > 953cadd34749.5672: Flags [P.], cksum 0x5971 (incorrect -> 0x6eac), seq 30150:30437, ack 615, win 237, options [nop,nop,TS val 3856144 ecr 3856144], length 287
E..Se.@.@.{..........t.(..).J[......Yq.....
.:...:..........<.(....fos_elastica_populate........-.<.............amq.gen-j3C2DcF1HNvErbC3NZxzOA........{"options":{"max_per_page":"1000","delete":true,"reset":true,"ignore_errors":false,"sleep":0,"indexName":"app","typeName":"order","query_builder_method":"transformDataForGrid"},"page":105}.
11:21:42.289054 IP (tos 0x0, ttl 64, id 26026, offset 0, flags [DF], proto TCP (6), length 339)
    populate.host.60532 > 953cadd34749.5672: Flags [P.], cksum 0x5971 (incorrect -> 0x6a6e), seq 30724:31011, ack 615, win 237, options [nop,nop,TS val 3856144 ecr 3856144], length 287
E..Se.@.@.{..........t.(..+.J[......Yq.....
.:...:..........<.(....fos_elastica_populate........-.<.............amq.gen-j3C2DcF1HNvErbC3NZxzOA........{"options":{"max_per_page":"1000","delete":true,"reset":true,"ignore_errors":false,"sleep":0,"indexName":"app","typeName":"order","query_builder_method":"transformDataForGrid"},"page":107}.
11:21:42.289205 IP (tos 0x0, ttl 64, id 26029, offset 0, flags [DF], proto TCP (6), length 339)
    populate.host.60532 > 953cadd34749.5672: Flags [P.], cksum 0x5971 (incorrect -> 0x6e0f), seq 31585:31872, ack 615, win 237, options [nop,nop,TS val 3856145 ecr 3856144], length 287
E..Se.@.@.{..........t.(../+J[......Yq.....
.:...:..........<.(....fos_elastica_populate........-.<.............amq.gen-j3C2DcF1HNvErbC3NZxzOA........{"options":{"max_per_page":"1000","delete":true,"reset":true,"ignore_errors":false,"sleep":0,"indexName":"app","typeName":"order","query_builder_method":"transformDataForGrid"},"page":110}.
11:21:42.289305 IP (tos 0x0, ttl 64, id 26031, offset 0, flags [DF], proto TCP (6), length 339)
    populate.host.60532 > 953cadd34749.5672: Flags [P.], cksum 0x5971 (incorrect -> 0x69d1), seq 32159:32446, ack 615, win 237, options [nop,nop,TS val 3856145 ecr 3856144], length 287
E..Se.@.@.{..........t.(..1iJ[......Yq.....
.:...:..........<.(....fos_elastica_populate........-.<.............amq.gen-j3C2DcF1HNvErbC3NZxzOA........{"options":{"max_per_page":"1000","delete":true,"reset":true,"ignore_errors":false,"sleep":0,"indexName":"app","typeName":"order","query_builder_method":"transformDataForGrid"},"page":112}.
11:21:42.289449 IP (tos 0x0, ttl 64, id 26035, offset 0, flags [DF], proto TCP (6), length 339)
    populate.host.60532 > 953cadd34749.5672: Flags [P.], cksum 0x5971 (incorrect -> 0x6155), seq 33307:33594, ack 615, win 237, options [nop,nop,TS val 3856145 ecr 3856144], length 287
E..Se.@.@.{..........t.(..5.J[......Yq.....
.:...:..........<.(....fos_elastica_populate........-.<.............amq.gen-j3C2DcF1HNvErbC3NZxzOA........{"options":{"max_per_page":"1000","delete":true,"reset":true,"ignore_errors":false,"sleep":0,"indexName":"app","typeName":"order","query_builder_method":"transformDataForGrid"},"page":116}.
11:21:42.299195 IP (tos 0x0, ttl 64, id 26038, offset 0, flags [DF], proto TCP (6), length 1500)
    populate.host.60532 > 953cadd34749.5672: Flags [.], cksum 0x5dfa (incorrect -> 0x26bc), seq 34168:35616, ack 615, win 237, options [nop,nop,TS val 3856155 ecr 3856144], length 1448
E...e.@.@.w:.........t.(..9BJ[......]......
.:...:..........<.(....fos_elastica_populate........-.<.............amq.gen-j3C2DcF1HNvErbC3NZxzOA........{"options":{"max_per_page":"1000","delete":true,"reset":true,"ignore_errors":false,"sleep":0,"indexName":"app","typeName":"order","query_builder_method":"transformDataForGrid"},"page":119}.........<.(....fos_elastica_populate........-.<.............amq.gen-j3C2DcF1HNvErbC3NZxzOA........{"options":{"max_per_page":"1000","delete":true,"reset":true,"ignore_errors":false,"sleep":0,"indexName":"app","typeName":"order","query_builder_method":"transformDataForGrid"},"page":120}.........<.(....fos_elastica_populate........-.<.............amq.gen-j3C2DcF1HNvErbC3NZxzOA........{"options":{"max_per_page":"1000","delete":true,"reset":true,"ignore_errors":false,"sleep":0,"indexName":"app","typeName":"order","query_builder_method":"transformDataForGrid"},"page":121}.........<.(....fos_elastica_populate........-.<.............amq.gen-j3C2DcF1HNvErbC3NZxzOA........{"options":{"max_per_page":"1000","delete":true,"reset":true,"ignore_errors":false,"sleep":0,"indexName":"app","typeName":"order","query_builder_method":"transformDataForGrid"},"page":122}.........<.(....fos_elastica_populate........-.<.............amq.gen-j3C2DcF1HNvErbC3NZxzOA........{"options":{"max_per_page":"1000","delete":true,"reset":true,"ignore_errors":false,"sleep":0,"indexName":"app","typeName":"order","query_builder_method":"transformDataForGrid"},"page":123}.........<.(..
11:21:42.300314 IP (tos 0x0, ttl 64, id 43680, offset 0, flags [DF], proto TCP (6), length 52)
    953cadd34749.5672 > populate.host.60532: Flags [.], cksum 0x5852 (incorrect -> 0xd015), seq 615, ack 35616, win 1123, options [nop,nop,TS val 3856156 ecr 3856145], length 0
E..4..@.@.7..........(.tJ[....>....cXR.....
.:...:..
11:21:42.300348 IP (tos 0x0, ttl 64, id 26039, offset 0, flags [DF], proto TCP (6), length 14532)
    populate.host.60532 > 953cadd34749.5672: Flags [.], cksum 0x90e2 (incorrect -> 0x545a), seq 35616:50096, ack 615, win 237, options [nop,nop,TS val 3856156 ecr 3856156], length 14480
E.8.e.@.@.DQ.........t.(..>.J[.............
.:...:....fos_elastica_populate........-.<.............amq.gen-j3C2DcF1HNvErbC3NZxzOA........{"options":{"max_per_page":"1000","delete":true,"reset":true,"ignore_errors":false,"sleep":0,"indexName":"app","typeName":"order","query_builder_method":"transformDataForGrid"},"page":124}.........<.(....fos_elastica_populate........-.<.............amq.gen-j3C2DcF1HNvErbC3NZxzOA........{"options":{"max_per_page":"1000","delete":true,"reset":true,"ignore_errors":false,"sleep":0,"indexName":"app","typeName":"order","query_builder_method":"transformDataForGrid"},"page":125}.........<.(....fos_elastica_populate........-.<.............amq.gen-j3C2DcF1HNvErbC3NZxzOA........{"options":{"max_per_page":"1000","delete":true,"reset":true,"ignore_errors":false,"sleep":0,"indexName":"app","typeName":"order","query_builder_method":"transformDataForGrid"},"page":126}.........<.(....fos_elastica_populate........-.<.............amq.gen-j3C2DcF1HNvErbC3NZxzOA........{"options":{"max_per_page":"1000","delete":true,"reset":true,"ignore_errors":false,"sleep":0,"indexName":"app","typeName":"order","query_builder_method":"transformDataForGrid"},"page":127}.........<.(....fos_elastica_populate........-.<.............amq.gen-j3C2DcF1HNvErbC3NZxzOA........{"options":{"max_per_page":"1000","delete":true,"reset":true,"ignore_errors":false,"sleep":0,"indexName":"app","typeName":"order","query_builder_method":"transformDataForGrid"},"page":128}.........<.(....fos_elastica_populate........-.<.............amq.gen-j3C2DcF1HNvErbC3NZxzOA........{"options":{"max_per_page":"1000","delete":true,"reset":true,"ignore_errors":false,"sleep":0,"indexName":"app","typeName":"order","query_builder_method":"transformDataForGrid"},"page":129}.........<.(....fos_elastica_populate........-.<.............amq.gen-j3C2DcF1HNvErbC3NZxzOA........{"options":{"max_per_page":"1000","delete":true,"reset":true,"ignore_errors":false,"sleep":0,"indexName":"app","typeName":"order","query_builder_method":"transformDataForGrid"},"page":130}.........<.(....fos_elastica_populate........-.<.............amq.gen-j3C2DcF1HNvErbC3NZxzOA........{"options":{"max_per_page":"1000","delete":true,"reset":true,"ignore_errors":false,"sleep":0,"indexName":"app","typeName":"order","query_builder_method":"transformDataForGrid"},"page":131}.........<.(....fos_elastica_populate........-.<.............amq.gen-j3C2DcF1HNvErbC3NZxzOA........{"options":{"max_per_page":"1000","delete":true,"reset":true,"ignore_errors":false,"sleep":0,"indexName":"app","typeName":"order","query_builder_method":"transformDataForGrid"},"page":132}.........<.(....fos_elastica_populate........-.<.............amq.gen-j3C2DcF1HNvErbC3NZxzOA........{"options":{"max_per_page":"1000","delete":true,"reset":true,"ignore_errors":false,"sleep":0,"indexName":"app","typeName":"order","query_builder_method":"transformDataForGrid"},"page":133}.........<.(....fos_elastica_populate........-.<.............amq.gen-j3C2DcF1HNvErbC3NZxzOA........{"options":{"max_per_page":"1000","delete":true,"reset":true,"ignore_errors":false,"sleep":0,"indexName":"app","typeName":"order","query_builder_method":"transformDataForGrid"},"page":134}.........<.(....fos_elastica_populate........-.<.............amq.gen-j3C2DcF1HNvErbC3NZxzOA........{"options":{"max_per_page":"1000","delete":true,"reset":true,"ignore_errors":false,"sleep":0,"indexName":"app","typeName":"order","query_builder_method":"transformDataForGrid"},"page":135}.........<.(....fos_elastica_populate........-.<.............amq.gen-j3C2DcF1HNvErbC3NZxzOA........{"options":{"max_per_page":"1000","delete":true,"reset":true,"ignore_errors":false,"sleep":0,"indexName":"app","typeName":"order","query_builder_method":"transformDataForGrid"},"page":136}.........<.(....fos_elastica_populate........-.<.............amq.gen-j3C2DcF1HNvErbC3NZxzOA........{"options":{"max_per_page":"1000","delete":true,"reset":true,"ignore_errors":false,"sleep":0,"indexName":"app","typeName":"order","query_builder_method":"transformDataForGrid"},"page":137}.........<.(....fos_elastica_populate........-.<.............amq.gen-j3C2DcF1HNvErbC3NZxzOA........{"options":{"max_per_page":"1000","delete":true,"reset":true,"ignore_errors":false,"sleep":0,"indexName":"app","typeName":"order","query_builder_method":"transformDataForGrid"},"page":138}.........<.(....fos_elastica_populate........-.<.............amq.gen-j3C2DcF1HNvErbC3NZxzOA........{"options":{"max_per_page":"1000","delete":true,"reset":true,"ignore_errors":false,"sleep":0,"indexName":"app","typeName":"order","query_builder_method":"transformDataForGrid"},"page":139}.........<.(....fos_elastica_populate........-.<.............amq.gen-j3C2DcF1HNvErbC3NZxzOA........{"options":{"max_per_page":"1000","delete":true,"reset":true,"ignore_errors":false,"sleep":0,"indexName":"app","typeName":"order","query_builder_method":"transformDataForGrid"},"page":140}.........<.(....fos_elastica_populate........-.<.............amq.gen-j3C2DcF1HNvErbC3NZxzOA........{"options":{"max_per_page":"1000","delete":true,"reset":true,"ignore_errors":false,"sleep":0,"indexName":"app","typeName":"order","query_builder_method":"transformDataForGrid"},"page":141}.........<.(....fos_elastica_populate........-.<.............amq.gen-j3C2DcF1HNvErbC3NZxzOA........{"options":{"max_per_page":"1000","delete":true,"reset":true,"ignore_errors":false,"sleep":0,"indexName":"app","typeName":"order","query_builder_method":"transformDataForGrid"},"page":142}.........<.(....fos_elastica_populate........-.<.............amq.gen-j3C2DcF1HNvErbC3NZxzOA........{"options":{"max_per_page":"1000","delete":true,"reset":true,"ignore_errors":false,"sleep":0,"indexName":"app","typeName":"order","query_builder_method":"transformDataForGrid"},"page":143}.........<.(....fos_elastica_populate........-.<.............amq.gen-j3C2DcF1HNvErbC3NZxzOA........{"options":{"max_per_page":"1000","delete":true,"reset":true,"ignore_errors":false,"sleep":0,"indexName":"app","typeName":"order","query_builder_method":"transformDataForGrid"},"page":144}.........<.(....fos_elastica_populate........-.<.............amq.gen-j3C2DcF1HNvErbC3NZxzOA........{"options":{"max_per_page":"1000","delete":true,"reset":true,"ignore_errors":false,"sleep":0,"indexName":"app","typeName":"order","query_builder_method":"transformDataForGrid"},"page":145}.........<.(....fos_elastica_populate........-.<.............amq.gen-j3C2DcF1HNvErbC3NZxzOA........{"options":{"max_per_page":"1000","delete":true,"reset":true,"ignore_errors":false,"sleep":0,"indexName":"app","typeName":"order","query_builder_method":"transformDataForGrid"},"page":146}.........<.(....fos_elastica_populate........-.<.............amq.gen-j3C2DcF1HNvErbC3NZxzOA........{"options":{"max_per_page":"1000","delete":true,"reset":true,"ignore_errors":false,"sleep":0,"indexName":"app","typeName":"order","query_builder_method":"transformDataForGrid"},"page":147}.........<.(....fos_elastica_populate........-.<.............amq.gen-j3C2DcF1HNvErbC3NZxzOA........{"options":{"max_per_page":"1000","delete":true,"reset":true,"ignore_errors":false,"sleep":0,"indexName":"app","typeName":"order","query_builder_method":"transformDataForGrid"},"page":148}.........<.(....fos_elastica_populate........-.<.............amq.gen-j3C2DcF1HNvErbC3NZxzOA........{"options":{"max_per_page":"1000","delete":true,"reset":true,"ignore_errors":false,"sleep":0,"indexName":"app","typeName":"order","query_builder_method":"transformDataForGrid"},"page":149}.........<.(....fos_elastica_populate........-.<.............amq.gen-j3C2DcF1HNvErbC3NZxzOA........{"options":{"max_per_page":"1000","delete":true,"reset":true,"ignore_errors":false,"sleep":0,"indexName":"app","typeName":"order","query_builder_method":"transformDataForGrid"},"page":150}.........<.(....fos_elastica_populate........-.<.............amq.gen-j3C2DcF1HNvErbC3NZxzOA........{"options":{"max_per_page":"1000","delete":true,"reset":true,"ignore_errors":false,"sleep":0,"indexName":"app","typeName":"order","query_builder_method":"transformDataForGrid"},"page":151}.........<.(....fos_elastica_populate........-.<.............amq.gen-j3C2DcF1HNvErbC3NZxzOA........{"options":{"max_per_page":"1000","delete":true,"reset":true,"ignore_errors":false,"sleep":0,"indexName":"app","typeName":"order","query_builder_method":"transformDataForGrid"},"page":152}.........<.(....fos_elastica_populate........-.<.............amq.gen-j3C2DcF1HNvErbC3NZxzOA........{"options":{"max_per_page":"1000","delete":true,"reset":true,"ignore_errors":false,"sleep":0,"indexName":"app","typeName":"order","query_builder_method":"transformDataForGrid"},"page":153}.........<.(....fos_elastica_populate........-.<.............amq.gen-j3C2DcF1HNvErbC3NZxzOA........{"options":{"max_per_page":"1000","delete":true,"reset":true,"ignore_errors":false,"sleep":0,"indexName":"app","typeName":"order","query_builder_method":"transformDataForGrid"},"page":154}.........<.(....fos_elastica_populate........-.<.............amq.gen-j3C2DcF1HNvErbC3NZxzOA........{"options":{"max_per_page":"1000","delete":true,"reset":true,"ignore_errors":false,"sleep":0,"indexName":"app","typeName":"order","query_builder_method":"transformDataForGrid"},"page":155}.........<.(....fos_elastica_populate........-.<.............amq.gen-j3C2DcF1HNvErbC3NZxzOA........{"options":{"max_per_page":"1000","delete":true,"reset":true,"ignore_errors":false,"sleep":0,"indexName":"app","typeName":"order","query_builder_method":"transformDataForGrid"},"page":156}.........<.(....fos_elastica_populate........-.<.............amq.gen-j3C2DcF1HNvErbC3NZxzOA........{"options":{"max_per_page":"1000","delete":true,"reset":true,"ignore_errors":false,"sleep":0,"indexName":"app","typeName":"order","query_builder_method":"transformDataForGrid"},"page":157}.........<.(....fos_elastica_populate........-.<.............amq.gen-j3C2DcF1HNvErbC3NZxzOA........{"options":{"max_per_page":"1000","delete":true,"reset":true,"ignore_errors":false,"sleep":0,"indexName":"app","typeName":"order","query_builder_method":"transformDataForGrid"},"page":158}.........<.(....fos_elastica_populate........-.<.............amq.gen-j3C2DcF1HNvErbC3NZxzOA........{"options":{"max_per_page":"1000","delete":true,"reset":true,"ignore_errors":false,"sleep":0,"indexName":"app","typeName":"order","query_builder_method":"transformDataForGrid"},"page":159}.........<.(....fos_elastica_populate........-.<.............amq.gen-j3C2DcF1HNvErbC3NZxzOA........{"options":{"max_per_page":"1000","delete":true,"reset":true,"ignore_errors":false,"sleep":0,"indexName":"app","typeName":"order","query_builder_method":"transformDataForGrid"},"page":160}.........<.(....fos_elastica_populate........-.<.............amq.gen-j3C2DcF1HNvErbC3NZxzOA........{"options":{"max_per_page":"1000","delete":true,"reset":true,"ignore_errors":false,"sleep":0,"indexName":"app","typeName":"order","query_builder_method":"transformDataForGrid"},"page":161}.........<.(....fos_elastica_populate........-.<.............amq.gen-j3C2DcF1HNvErbC3NZxzOA........{"options":{"max_per_page":"1000","delete":true,"reset":true,"ignore_errors":false,"sleep":0,"indexName":"app","typeName":"order","query_builder_method":"transformDataForGrid"},"page":162}.........<.(....fos_elastica_populate........-.<.............amq.gen-j3C2DcF1HNvErbC3NZxzOA........{"options":{"max_per_page":"1000","delete":true,"reset":true,"ignore_errors":false,"sleep":0,"indexName":"app","typeName":"order","query_builder_method":"transformDataForGrid"},"page":163}.........<.(....fos_elastica_populate........-.<.............amq.gen-j3C2DcF1HNvErbC3NZxzOA........{"options":{"max_per_page":"1000","delete":true,"reset":true,"ignore_errors":false,"sleep":0,"indexName":"app","typeName":"order","query_builder_method":"transformDataForGrid"},"page":164}.........<.(....fos_elastica_populate........-.<.............amq.gen-j3C2DcF1HNvErbC3NZxzOA........{"options":{"max_per_page":"1000","delete":true,"reset":true,"ignore_errors":false,"sleep":0,"indexName":"app","typeName":"order","query_builder_method":"transformDataForGrid"},"page":165}.........<.(....fos_elastica_populate........-.<.............amq.gen-j3C2DcF1HNvErbC3NZxzOA........{"options":{"max_per_page":"1000","delete":true,"reset":true,"ignore_errors":false,"sleep":0,"indexName":"app","typeName":"order","query_builder_method":"transformDataForGrid"},"page":166}.........<.(....fos_elastica_populate........-.<.............amq.gen-j3C2DcF1HNvErbC3NZxzOA........{"options":{"max_per_page":"1000","delete":true,"reset":true,"ignore_errors":false,"sleep":0,"indexName":"app","typeName":"order","query_builder_method":"transformDataForGrid"},"page":167}.........<.(....fos_elastica_populate........-.<.............amq.gen-j3C2DcF1HNvErbC3NZxzOA........{"options":{"max_per_page":"1000","delete":true,"reset":true,"ignore_errors":false,"sleep":0,"indexName":"app","typeName":"order","query_builder_method":"transformDataForGrid"},"page":168}.........<.(....fos_elastica_populate........-.<.............amq.gen-j3C2DcF1HNvErbC3NZxzOA........{"options":{"max_per_page":"1000","delete":true,"reset":true,"ignore_errors":false,"sleep":0,"indexName":"app","typeName":"order","query_builder_method":"transformDataForGrid"},"page":169}.........<.(....fos_elastica_populate........-.<.............amq.gen-j3C2DcF1HNvErbC3NZxzOA........{"options":{"max_per_page":"1000","delete":true,"reset":true,"ignore_errors":false,"sleep":0,"indexName":"app","typeName":"order","query_builder_method":"transformDataForGrid"},"page":170}.........<.(....fos_elastica_populate........-.<.............amq.gen-j3C2DcF1HNvErbC3NZxzOA........{"options":{"max_per_page":"1000","delete":true,"reset":true,"ignore_errors":false,"sleep":0,"indexName":"app","typeName":"order","query_builder_method":"transformDataForGrid"},"page":171}.........<.(....fos_elastica_populate........-.<.............amq.gen-j3C2DcF1HNvErbC3NZxzOA........{"options":{"max_per_page":"1000","delete":true,"reset":true,"ignore_errors":false,"sleep":0,"indexName":"app","typeName":"order","query_builder_method":"transformDataForGrid"},"page":172}.........<.(....fos_elastica_populate........-.<.............amq.gen-j3C2DcF1HNvErbC3NZxzOA........{"options":{"max_per_page":"1000","delete":true,"reset":true,"ignore_errors":false,"sleep":0,"indexName":"app","typeName":"order","query_builder_method":"transformDataForGrid"},"page":173}.........<.(....fos_elastica_populate........-.<.............amq.gen-j3C2DcF1HNvErbC3NZxzOA........{"options":{"max_per_page":"1000","delete":tr
11:21:42.300349 IP (tos 0x0, ttl 64, id 26049, offset 0, flags [DF], proto TCP (6), length 14532)
    populate.host.60532 > 953cadd34749.5672: Flags [.], cksum 0x90e2 (incorrect -> 0x1cd3), seq 50096:64576, ack 615, win 237, options [nop,nop,TS val 3856156 ecr 3856156], length 14480
```

**Comment by kricha** [comment]
If we add on this line https://github.com/php-enqueue/enqueue-elastica-bundle/blob/master/Persister/QueuePagerPersister.php#L95

at least `usleep(10)` it works fine
@makasim

**Comment by makasim** [comment]
Could you please test if it works if we do usleep every say 500 records?

**Comment by kricha** [comment]
@makasim 500 records could be too much for rabbitmq frame_size. usleep(10) does not affect on performance. I also tried to test with usleep(0) and in 7/10 it works fine.

**Comment by makasim** [comment]
Just wondering, could we catch the exception "Resource temporarily unavailable" and only at that time sleep?

**Comment by kricha** [comment]
@makasim i think at that time connection will be closed and bulk of messages (sent before) will be unaccepted by rabbit

**Comment by makasim** [comment]
ok, let's add usleep as you suggested with a comment and a link to this issue.

**Comment by kricha** [comment]
@makasim i could create pr here: https://github.com/php-enqueue/enqueue-elastica-bundle ?

**Comment by makasim** [comment]
yes, please

**Comment by kricha** [comment]
@makasim done https://github.com/php-enqueue/enqueue-elastica-bundle/pull/20

**Comment by makasim** [comment]
merged. thanks
